{
  "id": "azure-government-test",
  "displayName": "Azure Government Test",
  "cloud": "AzureGovernment",
  "tenantId": "00000000-0000-0000-0000-000000000000",
  "subscriptionId": "00000000-0000-0000-0000-000000000000",
  "managementGroupId": "00000000-0000-0000-0000-000000000000",
  "defaultLocation": "usgovvirginia",
  "allowedLocations": ["usgovvirginia", "usgovarizona"],
  "resourceGroupStrategy": {
    "mode": "CreatePerWorkload",
    "namePattern": "rg-amw-{workload}-{environment}-{location}",
    "tagsInherited": true
  },
  "networkIntegration": {
    "vnetStrategy": "Required",
    "privateEndpointRequiredPatterns": ["storage-account", "key-vault"],
    "approvedSubnetResourceIds": [
      "/subscriptions/00000000-0000-0000-0000-000000000000/resourceGroups/rg-network/providers/Microsoft.Network/virtualNetworks/vnet-gov/subnets/snet-appsvc-test",
      "/subscriptions/00000000-0000-0000-0000-000000000000/resourceGroups/rg-network/providers/Microsoft.Network/virtualNetworks/vnet-gov/subnets/snet-private-endpoints"
    ]
  },
  "privateDnsConfiguration": {
    "enabled": true,
    "zoneResourceIds": [
      "/subscriptions/00000000-0000-0000-0000-000000000000/resourceGroups/rg-network/providers/Microsoft.Network/privateDnsZones/privatelink.azurewebsites.us",
      "/subscriptions/00000000-0000-0000-0000-000000000000/resourceGroups/rg-network/providers/Microsoft.Network/privateDnsZones/privatelink.blob.core.usgovcloudapi.net",
      "/subscriptions/00000000-0000-0000-0000-000000000000/resourceGroups/rg-network/providers/Microsoft.Network/privateDnsZones/privatelink.vaultcore.usgovcloudapi.net"
    ]
  },
  "logAnalyticsWorkspaceResourceId": "/subscriptions/00000000-0000-0000-0000-000000000000/resourceGroups/rg-observability/providers/Microsoft.OperationalInsights/workspaces/law-platform-gov-test",
  "policyAssignmentScope": "/providers/Microsoft.Management/managementGroups/00000000-0000-0000-0000-000000000000",
  "approvedModuleRegistry": {
    "alias": "missionworkspace",
    "registry": "missionworkspace.azurecr.io",
    "modulePath": "bicep/modules"
  },
  "requiredTags": ["costCenter", "owner", "environment", "dataClassification"],
  "allowedServicePatterns": ["internal-web-api", "internal-web-app", "storage-account", "key-vault"],
  "approvalPolicy": {
    "productionApprovers": 2,
    "changeWindowRequired": true,
    "maxValidationAgeHours": 8
  },
  "deploymentIdentityReference": {
    "type": "FederatedServiceConnection",
    "value": "azdo-sc-amw-gov-test"
  }
}
